{"binding":{"path":"audits/2026-09-18-autograd-context/english-r3/bundle/bindings.json","sha256":"fa18678d484bc5cfa9e6022052cd91bd7da963fea1bc4b5f8384d846177c6ff9"},"bundle":{"path":"audits/2026-09-18-autograd-context/english-r3/bundle/technical-pedagogical/review-bundle.json","sha256":"b8ab54be38952b4210fdd45ca537fcd41dc2078d44b340a5d739a03e78b386e3"},"candidateId":"autograd-context-ch33-ch37.en.r12-r6.20260918.r3","context":{"path":"audits/2026-09-18-autograd-context/english-r3/review-routing/contexts/technical-pedagogical.json","sha256":"9de220c7c3dd150ebb4fc874e8bfbcbf2cd95c775c4a3c4e4488b15d2bc33bb4"},"inventory":{"path":"audits/2026-09-18-autograd-context/english-r3/bundle/inventory.json","sha256":"7a1829bbfe94eda3a844674204b1410a17d771dfd28d74bc069865500bc5b060"},"kind":"review","model":"gpt-5.6-sol","prompt":{"path":"audits/2026-09-18-autograd-context/english-r3/review-routing/prompts/technical-pedagogical.json","sha256":"7c856b30a0eb10c2e4683054594c25730ad2a47ece93c105aa20bf6577add7db"},"rawResponse":{"path":"audits/2026-09-18-autograd-context/english-r3/raw/technical-pedagogical.json","sha256":"b356d9b9b6254a8087fc99098ae8af776dcf2629bb64712b2fe0f55b2dd4cab6"},"reasoning":"ultra","receiptSchema":{"path":".agents/skills/author-llm-course-english/references/evidence-receipt.schema.json","sha256":"fd3a1d8ce1230959551456015b642044fd2d60acae11bbf8ef2b5a0efbddeb87"},"record":{"path":"audits/2026-09-18-autograd-context/english-r3/review-seals/technical-pedagogical/record.json","sha256":"b356d9b9b6254a8087fc99098ae8af776dcf2629bb64712b2fe0f55b2dd4cab6"},"role":"technical-pedagogical","routing":{"path":"audits/2026-09-18-autograd-context/english-r3/review-routing/review-routing.json","sha256":"2a8bf6e324ae214e9d79d0faa36ba08563fb537f756e4c53b7afe02b1e68f381"},"schema":{"path":".agents/skills/author-llm-course-english/references/review-record.schema.json","sha256":"b925cf70d225af0e992c47c0000149c6d430424aee5878ff42f388948f8e7177"},"schemaVersion":1,"scopeId":"autograd-context-ch33-ch37.en.20260918.r3","subjectId":"autograd-context-ch33-ch37.en.r12-r6.20260918.r3.technical-pedagogical-review","upstreamReceipt":null}
