{"binding":{"path":"audits/practical-llm-in-rust/chapters/03-scalable-bpe-tokenizer/20261009T105211Z-02/english/review-bundles/bindings.json","sha256":"a29cf2be819493f9d475e4f993352fe6628379127e75d3d957f4e4b74433308b"},"bundle":{"path":"audits/practical-llm-in-rust/chapters/03-scalable-bpe-tokenizer/20261009T105211Z-02/english/adjudication-bundles/technical-pedagogical/adjudication-bundle.json","sha256":"fbbfefd5c35d829c77fbeaf76be274516092d07990b7107136f18b7ac65fdb76"},"candidateId":"practical.ch03.en.20261009.02","context":{"path":"audits/practical-llm-in-rust/chapters/03-scalable-bpe-tokenizer/20261009T105211Z-02/english/adjudication-routing/contexts/technical-pedagogical.json","sha256":"3e3f59ebe3de50e780ec226c3befec5fc1b32d3b98730e17cb9455a6bf3cc3bd"},"inventory":{"path":"audits/practical-llm-in-rust/chapters/03-scalable-bpe-tokenizer/20261009T105211Z-02/english/review-bundles/inventory.json","sha256":"f39a3a51762b6150049170b4ad04885c38734fd8a1df9604f866c49303480a86"},"kind":"adjudication","model":"gpt-6.1-sol","prompt":{"path":"audits/practical-llm-in-rust/chapters/03-scalable-bpe-tokenizer/20261009T105211Z-02/english/adjudication-routing/prompts/technical-pedagogical.json","sha256":"328ba25abc094aebe0573e4f40c2440643f48d7c68fd51f7ff6c2370569b8017"},"rawResponse":{"path":"audits/practical-llm-in-rust/chapters/03-scalable-bpe-tokenizer/20261009T105211Z-02/english/adjudication-raw-responses/technical-pedagogical.json","sha256":"12fa3a8e89c7f56d86f60cc3ef049d7a40bb9433ec54c38ea49dc3da06731532"},"reasoning":"max","receiptSchema":{"path":".agents/skills/author-llm-course-english/references/evidence-receipt.schema.json","sha256":"fd3a1d8ce1230959551456015b642044fd2d60acae11bbf8ef2b5a0efbddeb87"},"record":{"path":"audits/practical-llm-in-rust/chapters/03-scalable-bpe-tokenizer/20261009T105211Z-02/english/adjudication-seals/technical-pedagogical/record.json","sha256":"12fa3a8e89c7f56d86f60cc3ef049d7a40bb9433ec54c38ea49dc3da06731532"},"role":"technical-pedagogical","routing":{"path":"audits/practical-llm-in-rust/chapters/03-scalable-bpe-tokenizer/20261009T105211Z-02/english/adjudication-routing/adjudication-routing.json","sha256":"183c1ebf75a88a5d6df5b9cf57881e396e5602c35fcc010dc274f959c82e86af"},"schema":{"path":".agents/skills/author-llm-course-english/references/adjudication-record.schema.json","sha256":"6463982e2e84c5cea564699242abc5e681d13364e3b7457961d62f9b3c26ca69"},"schemaVersion":1,"scopeId":"practical.ch03.en","subjectId":"practical.ch03.en.20261009.02.technical-pedagogical.01a121ae","upstreamReceipt":{"path":"audits/practical-llm-in-rust/chapters/03-scalable-bpe-tokenizer/20261009T105211Z-02/english/review-seals/technical-pedagogical/receipt.json","sha256":"1705ebb4c89fd6b1c86dfee94ad9535d3a43e705e09bb330ccbce1570ef4a53a"}}
