{"binding":{"path":"audits/functional-laptop/reviews/42-deterministic-corpus-filtering/english/bundle/bindings.json","sha256":"616777855d7b2f211cee5566b8ff2e0c8aa27add632d41693cb74657ef7c1c4d"},"bundle":{"path":"audits/functional-laptop/reviews/42-deterministic-corpus-filtering/english/bundle/isolated-surface/review-bundle.json","sha256":"907acd8284691011861851eb74dcaadd28aeaf5d551547fe45c435b7c9ec05ac"},"candidateId":"ch42.en.20261007.r03.03","context":{"path":"audits/functional-laptop/reviews/42-deterministic-corpus-filtering/english/review-routing/contexts/isolated-surface.json","sha256":"8447dedf1331dad581422faec7b7511345caa0b70fdc2d417295ab0c80c16ec7"},"inventory":{"path":"audits/functional-laptop/reviews/42-deterministic-corpus-filtering/english/bundle/inventory.json","sha256":"60e8640db1e0c80fbf238f29becf9c14d7065b7f85e6df0fc04676dfbc1ae495"},"kind":"review","model":"gpt-6.1-sol","prompt":{"path":"audits/functional-laptop/reviews/42-deterministic-corpus-filtering/english/review-routing/prompts/isolated-surface.json","sha256":"3446b07cf8acdfa4c1b7fee323637d57cfd561d9f70cc4081b1e16b96bf531ba"},"rawResponse":{"path":"audits/functional-laptop/reviews/42-deterministic-corpus-filtering/english/raw-responses/isolated-surface-review.json","sha256":"472fcbf9286c41a317484f719119262d9b30c1ef1a79f0df09194966f34f68d3"},"reasoning":"xhigh","receiptSchema":{"path":"audits/functional-laptop/reviews/42-deterministic-corpus-filtering/english/schemas/evidence-receipt.schema.json","sha256":"fd3a1d8ce1230959551456015b642044fd2d60acae11bbf8ef2b5a0efbddeb87"},"record":{"path":"audits/functional-laptop/reviews/42-deterministic-corpus-filtering/english/review-seals/isolated-surface/record.json","sha256":"472fcbf9286c41a317484f719119262d9b30c1ef1a79f0df09194966f34f68d3"},"role":"isolated-surface","routing":{"path":"audits/functional-laptop/reviews/42-deterministic-corpus-filtering/english/review-routing.json","sha256":"80e3f3a427b3b11cbd518df373c268897c7a646e425863a514adf75a435d0029"},"schema":{"path":"audits/functional-laptop/reviews/42-deterministic-corpus-filtering/english/schemas/review-record.schema.json","sha256":"b925cf70d225af0e992c47c0000149c6d430424aee5878ff42f388948f8e7177"},"schemaVersion":1,"scopeId":"ch42.en.deterministic-corpus-filtering","subjectId":"ch42.review.isolated.20261007.r03v03.01","upstreamReceipt":null}
