{"binding":{"path":"audits/functional-laptop/reviews/41-governed-corpus-acquisition/english-candidate-01/bundle/bindings.json","sha256":"2f199f74ee78ea6599179658814073baf632559edfdb2557e42c0fbe75ed5e86"},"bundle":{"path":"audits/functional-laptop/reviews/41-governed-corpus-acquisition/english-candidate-01/bundle/technical-pedagogical/review-bundle.json","sha256":"b061fcf60fd5a7a00bb71b27db9cdc1690065557e740b2459e2889cce70ccfa6"},"candidateId":"ch41.en.phase-a.20261005.r1","context":{"path":"audits/functional-laptop/reviews/41-governed-corpus-acquisition/english-candidate-01/review-routing/contexts/technical-pedagogical.json","sha256":"ffd728056c6210cba5822c54a5516eb89fee2cc93d6629d386743ac102594c03"},"inventory":{"path":"audits/functional-laptop/reviews/41-governed-corpus-acquisition/english-candidate-01/bundle/inventory.json","sha256":"8ac3fbbd53cdb219d4b236da1da09ad6f40830f9098f76686fa3dd7ff5ce9ad5"},"kind":"review","model":"gpt-6.1-sol","prompt":{"path":"audits/functional-laptop/reviews/41-governed-corpus-acquisition/english-candidate-01/review-routing/prompts/technical-pedagogical.json","sha256":"7c856b30a0eb10c2e4683054594c25730ad2a47ece93c105aa20bf6577add7db"},"rawResponse":{"path":"audits/functional-laptop/reviews/41-governed-corpus-acquisition/english-candidate-01/raw-reviews/technical.json","sha256":"aac1dd9dc6b726f91c612c7cd75af8a33870eb225a0721a46d37ee705d3d0fa3"},"reasoning":"medium","receiptSchema":{"path":"audits/functional-laptop/reviews/41-governed-corpus-acquisition/english-candidate-01/schemas/evidence-receipt.schema.json","sha256":"fd3a1d8ce1230959551456015b642044fd2d60acae11bbf8ef2b5a0efbddeb87"},"record":{"path":"audits/functional-laptop/reviews/41-governed-corpus-acquisition/english-candidate-01/review-seals/technical-pedagogical/record.json","sha256":"aac1dd9dc6b726f91c612c7cd75af8a33870eb225a0721a46d37ee705d3d0fa3"},"role":"technical-pedagogical","routing":{"path":"audits/functional-laptop/reviews/41-governed-corpus-acquisition/english-candidate-01/review-routing/review-routing.json","sha256":"b6805d905cb805a57fe859cbe72255c7d0e28ceb95fe17dcb4437aa37b160263"},"schema":{"path":"audits/functional-laptop/reviews/41-governed-corpus-acquisition/english-candidate-01/schemas/review-record.schema.json","sha256":"b925cf70d225af0e992c47c0000149c6d430424aee5878ff42f388948f8e7177"},"schemaVersion":1,"scopeId":"ch41.en.phase-a","subjectId":"ch41.en.phase-a.technical-pedagogical.r1","upstreamReceipt":null}
