{"binding":{"path":"audits/functional-laptop/reviews/reference-core-reframe/english-candidate-01/bundle/bindings.json","sha256":"bd5ff6dcbff052768c035c82fd0089d82b60941d24a14eaf6a70eee4d714401d"},"bundle":{"path":"audits/functional-laptop/reviews/reference-core-reframe/english-candidate-01/adjudication-bundle/isolated-surface/adjudication-bundle.json","sha256":"c80f1ef064f735379308c07dd94efbdb42feb839977f544b291f3959c0485b5d"},"candidateId":"reference-core.en.command.final.20261005.r1","context":{"path":"audits/functional-laptop/reviews/reference-core-reframe/english-candidate-01/adjudication-routing/contexts/isolated-surface.json","sha256":"b07311474dc964809811bbf1b5f0b3cefdf724bbb1534434e04f1c209a679395"},"inventory":{"path":"audits/functional-laptop/reviews/reference-core-reframe/english-candidate-01/bundle/inventory.json","sha256":"7da2c5c8ec5a0a15cf4c66ad18480ac0ca1b7d613de304c48751c803aacd3ec1"},"kind":"adjudication","model":"gpt-6.1-sol","prompt":{"path":"audits/functional-laptop/reviews/reference-core-reframe/english-candidate-01/adjudication-routing/prompts/isolated-surface.json","sha256":"1eb6b75e802bfa0f7ef5f3aaeeffdb3453c19a467bf121367c424755e9a1bb83"},"rawResponse":{"path":"audits/functional-laptop/reviews/reference-core-reframe/english-candidate-01/raw-adjudications/isolated.json","sha256":"b3578fe7f004b6f4ca0fbd1bf39c045e5b471a09d9992104bc71ebb760a60efa"},"reasoning":"medium","receiptSchema":{"path":"audits/functional-laptop/reviews/reference-core-reframe/english-candidate-01/schemas/evidence-receipt.schema.json","sha256":"fd3a1d8ce1230959551456015b642044fd2d60acae11bbf8ef2b5a0efbddeb87"},"record":{"path":"audits/functional-laptop/reviews/reference-core-reframe/english-candidate-01/adjudication-seals/isolated-surface/record.json","sha256":"b3578fe7f004b6f4ca0fbd1bf39c045e5b471a09d9992104bc71ebb760a60efa"},"role":"isolated-surface","routing":{"path":"audits/functional-laptop/reviews/reference-core-reframe/english-candidate-01/adjudication-routing.json","sha256":"e704804f646d5572423864b5d07c4e442bf5bedbfb47b2e7da4e1e802f120349"},"schema":{"path":"audits/functional-laptop/reviews/reference-core-reframe/english-candidate-01/schemas/adjudication-record.schema.json","sha256":"6463982e2e84c5cea564699242abc5e681d13364e3b7457961d62f9b3c26ca69"},"schemaVersion":1,"scopeId":"reference-core.en.command.final","subjectId":"run04-isolated-adjudication-01","upstreamReceipt":{"path":"audits/functional-laptop/reviews/reference-core-reframe/english-candidate-01/review-seals/isolated-surface/receipt.json","sha256":"85deeab2c1bebda5fc58c56bcf4d8474dcf9262fecfa0822aee73b691f797e34"}}
