{"binding":{"path":"audits/2026-10-02-ch17-problem-first/english-r1/bundle/bindings.json","sha256":"84b320c2be53a9ac445e0095bae14ada77e9794bdff86ce5c6d65206e14da12b"},"bundle":{"path":"audits/2026-10-02-ch17-problem-first/english-r1/adjudication-bundle/technical-pedagogical/adjudication-bundle.json","sha256":"bb511b3fc1b5345062fadb88cfaef0dcad125ac6d9db51ae04f96edc3a2b8d8e"},"candidateId":"ch17.en.r5.20261002.r1","context":{"path":"audits/2026-10-02-ch17-problem-first/english-r1/adjudication-routing/contexts/technical-pedagogical.json","sha256":"cf93c67b8802873d6fc097d4308116f294bf87afdcc9230b72827977a0cc82fb"},"inventory":{"path":"audits/2026-10-02-ch17-problem-first/english-r1/bundle/inventory.json","sha256":"c46f381b14ac88b7ebc79c3e8599b37a173b2ffe3d44e52ac6920747310e59b9"},"kind":"adjudication","model":"gpt-6.1-sol","prompt":{"path":"audits/2026-10-02-ch17-problem-first/english-r1/adjudication-routing/prompts/technical-pedagogical.json","sha256":"328ba25abc094aebe0573e4f40c2440643f48d7c68fd51f7ff6c2370569b8017"},"rawResponse":{"path":"audits/2026-10-02-ch17-problem-first/english-r1/raw/adjudication-technical-pedagogical.json","sha256":"85da190ae8c1d415f161f9bff4768a686e8ff2bea37262c51e97a3ec67d6b45e"},"reasoning":"max","receiptSchema":{"path":".agents/skills/author-llm-course-english/references/evidence-receipt.schema.json","sha256":"fd3a1d8ce1230959551456015b642044fd2d60acae11bbf8ef2b5a0efbddeb87"},"record":{"path":"audits/2026-10-02-ch17-problem-first/english-r1/adjudication-seals/technical-pedagogical/record.json","sha256":"85da190ae8c1d415f161f9bff4768a686e8ff2bea37262c51e97a3ec67d6b45e"},"role":"technical-pedagogical","routing":{"path":"audits/2026-10-02-ch17-problem-first/english-r1/adjudication-routing/adjudication-routing.json","sha256":"50ca5f0058e1a06a8c83f49e8ff10066e48b17c5138c21c1f8b89142ba22c500"},"schema":{"path":".agents/skills/author-llm-course-english/references/adjudication-record.schema.json","sha256":"6463982e2e84c5cea564699242abc5e681d13364e3b7457961d62f9b3c26ca69"},"schemaVersion":1,"scopeId":"ch17.en.20261002.r1","subjectId":"ch17.en.r5.20261002.r1.adj.technical.1","upstreamReceipt":{"path":"audits/2026-10-02-ch17-problem-first/english-r1/review-seals/technical-pedagogical/receipt.json","sha256":"723b9749829edf325416f3005092229f4e4fd6f0fa51c2ccf37ae59f436455e0"}}
