{"binding":{"path":"audits/2026-10-02-ch17-problem-first/english-r4/bundle/bindings.json","sha256":"10911ceed291fd5e466b9b53a099064ee038b3e073de6202e3b556a63f9bd2a6"},"bundle":{"path":"audits/2026-10-02-ch17-problem-first/english-r4/bundle/isolated-surface/review-bundle.json","sha256":"47607dc1167503af86660d463d18c03dd46863d5d4833029ee1ae96821c252fe"},"candidateId":"ch17.en.r5.20261002.r4","context":{"path":"audits/2026-10-02-ch17-problem-first/english-r4/review-routing/contexts/isolated-surface.json","sha256":"ab1cf195e8495c77c82068f422864dd2d015662ee8244571824d9620017b5b2f"},"inventory":{"path":"audits/2026-10-02-ch17-problem-first/english-r4/bundle/inventory.json","sha256":"cb3223472477ce247c03d7f9c61faab374d51f2d10bad1384a1bc78dc86be87b"},"kind":"review","model":"gpt-6.1-sol","prompt":{"path":"audits/2026-10-02-ch17-problem-first/english-r4/review-routing/prompts/isolated-surface.json","sha256":"3446b07cf8acdfa4c1b7fee323637d57cfd561d9f70cc4081b1e16b96bf531ba"},"rawResponse":{"path":"audits/2026-10-02-ch17-problem-first/english-r4/raw/isolated-surface.json","sha256":"f85979f98fbdd205385dd83ed67ea2608bb29ed70986d40a9fe5685ed3a95392"},"reasoning":"xhigh","receiptSchema":{"path":".agents/skills/author-llm-course-english/references/evidence-receipt.schema.json","sha256":"fd3a1d8ce1230959551456015b642044fd2d60acae11bbf8ef2b5a0efbddeb87"},"record":{"path":"audits/2026-10-02-ch17-problem-first/english-r4/review-seals/isolated-surface/record.json","sha256":"f85979f98fbdd205385dd83ed67ea2608bb29ed70986d40a9fe5685ed3a95392"},"role":"isolated-surface","routing":{"path":"audits/2026-10-02-ch17-problem-first/english-r4/review-routing/review-routing.json","sha256":"e009cb1ae279dab77310035486c48ace43bde43ae0875ae405304e119a16d4c5"},"schema":{"path":".agents/skills/author-llm-course-english/references/review-record.schema.json","sha256":"b925cf70d225af0e992c47c0000149c6d430424aee5878ff42f388948f8e7177"},"schemaVersion":1,"scopeId":"ch17.en.20261002.r4","subjectId":"ch17.en.r5.20261002.r4.isolated-review","upstreamReceipt":null}
