{"binding":{"path":"audits/2026-10-02-ch17-problem-first/english-r6/bundle/bindings.json","sha256":"3383300d6f2b956144e7ce07cc449732b2a6b9039575026dd440ce69b95f1184"},"bundle":{"path":"audits/2026-10-02-ch17-problem-first/english-r6/adjudication-bundle/technical-pedagogical/adjudication-bundle.json","sha256":"002ea181e45ec95ce5c5d8742f3d4b224902049099f670ee567d395d2d23b8aa"},"candidateId":"ch17.en.r5.20261002.r6","context":{"path":"audits/2026-10-02-ch17-problem-first/english-r6/adjudication-routing/contexts/technical-pedagogical.json","sha256":"84a5765d2cd632d35ade5090ed51db32229c49a83b0b515930a0812102a02471"},"inventory":{"path":"audits/2026-10-02-ch17-problem-first/english-r6/bundle/inventory.json","sha256":"6649c5b389d90971d717ef268d97c2e0b611b3e66620b10d4b74682c1ce3247f"},"kind":"adjudication","model":"gpt-6.1-sol","prompt":{"path":"audits/2026-10-02-ch17-problem-first/english-r6/adjudication-routing/prompts/technical-pedagogical.json","sha256":"328ba25abc094aebe0573e4f40c2440643f48d7c68fd51f7ff6c2370569b8017"},"rawResponse":{"path":"audits/2026-10-02-ch17-problem-first/english-r6/raw/adjudication-technical-pedagogical.json","sha256":"0b7aa957f263506643721d4399ddc19725d10d60319f63f414715ea7efd8c4ca"},"reasoning":"xhigh","receiptSchema":{"path":".agents/skills/author-llm-course-english/references/evidence-receipt.schema.json","sha256":"fd3a1d8ce1230959551456015b642044fd2d60acae11bbf8ef2b5a0efbddeb87"},"record":{"path":"audits/2026-10-02-ch17-problem-first/english-r6/adjudication-seals/technical-pedagogical/record.json","sha256":"0b7aa957f263506643721d4399ddc19725d10d60319f63f414715ea7efd8c4ca"},"role":"technical-pedagogical","routing":{"path":"audits/2026-10-02-ch17-problem-first/english-r6/adjudication-routing/adjudication-routing.json","sha256":"a63f9cec3731d57295e11f0182811e9b6fb554e0c8a085fdef5ff0511fc0f8d5"},"schema":{"path":".agents/skills/author-llm-course-english/references/adjudication-record.schema.json","sha256":"6463982e2e84c5cea564699242abc5e681d13364e3b7457961d62f9b3c26ca69"},"schemaVersion":1,"scopeId":"ch17.en.20261002.r6","subjectId":"ch17.en.r6.adjudication.technical-pedagogical.20261002","upstreamReceipt":{"path":"audits/2026-10-02-ch17-problem-first/english-r6/review-seals/technical-pedagogical/receipt.json","sha256":"a80d6ba5b409ffb5b9e52893b5bc3ced7e6ad74bd70930ac8e3fd6f3cdcfe78c"}}
