{"binding":{"path":"audits/functional-laptop/reviews/41-governed-corpus-acquisition/english-candidate-02/bundle/bindings.json","sha256":"ef7feeb358b53d1a508b2e602ded9da0ed8fa15e6d5dfebd1946ec528c76afa9"},"bundle":{"path":"audits/functional-laptop/reviews/41-governed-corpus-acquisition/english-candidate-02/adjudication-bundle/isolated-surface/adjudication-bundle.json","sha256":"c00f55886cba1c69ec417c7a03d69bb58bd1f46f2d2559c4990953d2704670d3"},"candidateId":"ch41.en.phase-a.20261005.r2","context":{"path":"audits/functional-laptop/reviews/41-governed-corpus-acquisition/english-candidate-02/adjudication-routing/contexts/isolated-surface.json","sha256":"13357f5b2b90db937fc43c50954318096953ceec26236390e5358ec8bd124baf"},"inventory":{"path":"audits/functional-laptop/reviews/41-governed-corpus-acquisition/english-candidate-02/bundle/inventory.json","sha256":"bad30124898ef3ad8a48c0fbb6a8b5e08f4a64e857178bb3b29a8b62003631a1"},"kind":"adjudication","model":"gpt-6.1-sol","prompt":{"path":"audits/functional-laptop/reviews/41-governed-corpus-acquisition/english-candidate-02/adjudication-routing/prompts/isolated-surface.json","sha256":"1eb6b75e802bfa0f7ef5f3aaeeffdb3453c19a467bf121367c424755e9a1bb83"},"rawResponse":{"path":"audits/functional-laptop/reviews/41-governed-corpus-acquisition/english-candidate-02/raw-adjudications/isolated.json","sha256":"c5a83ac2ad9d7204ad4bd2874f5c6119fa646b95fd80d793d095f7ec906d9871"},"reasoning":"medium","receiptSchema":{"path":"audits/functional-laptop/reviews/41-governed-corpus-acquisition/english-candidate-02/schemas/evidence-receipt.schema.json","sha256":"fd3a1d8ce1230959551456015b642044fd2d60acae11bbf8ef2b5a0efbddeb87"},"record":{"path":"audits/functional-laptop/reviews/41-governed-corpus-acquisition/english-candidate-02/adjudication-seals/isolated-surface/record.json","sha256":"c5a83ac2ad9d7204ad4bd2874f5c6119fa646b95fd80d793d095f7ec906d9871"},"role":"isolated-surface","routing":{"path":"audits/functional-laptop/reviews/41-governed-corpus-acquisition/english-candidate-02/adjudication-routing/adjudication-routing.json","sha256":"3aeed26a16764e27485907ba3b6a5ec926c081f8d5c250d009f70bfd5b0858fb"},"schema":{"path":"audits/functional-laptop/reviews/41-governed-corpus-acquisition/english-candidate-02/schemas/adjudication-record.schema.json","sha256":"6463982e2e84c5cea564699242abc5e681d13364e3b7457961d62f9b3c26ca69"},"schemaVersion":1,"scopeId":"ch41.en.phase-a","subjectId":"ch41.en.phase-a.r2.isolated-surface.adjudication","upstreamReceipt":{"path":"audits/functional-laptop/reviews/41-governed-corpus-acquisition/english-candidate-02/review-seals/isolated-surface/receipt.json","sha256":"2b263a4af4402d25ab946f5e2730fb95172f4944d970a8b2ecaf2f353b046614"}}
