{"binding":{"path":"audits/practical-llm-in-rust/chapters/03-scalable-bpe-tokenizer/20261009T105211Z-02/english/review-bundles/bindings.json","sha256":"a29cf2be819493f9d475e4f993352fe6628379127e75d3d957f4e4b74433308b"},"bundle":{"path":"audits/practical-llm-in-rust/chapters/03-scalable-bpe-tokenizer/20261009T105211Z-02/english/review-bundles/technical-pedagogical/review-bundle.json","sha256":"3b9f40b27b1a8e59d5f03a67e209b564291f19ed077d764b9c62bdc23034c126"},"candidateId":"practical.ch03.en.20261009.02","context":{"path":"audits/practical-llm-in-rust/chapters/03-scalable-bpe-tokenizer/20261009T105211Z-02/english/review-routing/contexts/technical-pedagogical.json","sha256":"dc83ecdaf17353ffb21b34c19c74869271b1d01c3637842d963c69552361bc34"},"inventory":{"path":"audits/practical-llm-in-rust/chapters/03-scalable-bpe-tokenizer/20261009T105211Z-02/english/review-bundles/inventory.json","sha256":"f39a3a51762b6150049170b4ad04885c38734fd8a1df9604f866c49303480a86"},"kind":"review","model":"gpt-6.1-sol","prompt":{"path":"audits/practical-llm-in-rust/chapters/03-scalable-bpe-tokenizer/20261009T105211Z-02/english/review-routing/prompts/technical-pedagogical.json","sha256":"7c856b30a0eb10c2e4683054594c25730ad2a47ece93c105aa20bf6577add7db"},"rawResponse":{"path":"audits/practical-llm-in-rust/chapters/03-scalable-bpe-tokenizer/20261009T105211Z-02/english/review-raw-responses/technical-pedagogical.json","sha256":"14ebad8ebe01f9527a894f1850eb6a0bb572919c5f1a29011a3c8a67e634ad88"},"reasoning":"max","receiptSchema":{"path":".agents/skills/author-llm-course-english/references/evidence-receipt.schema.json","sha256":"fd3a1d8ce1230959551456015b642044fd2d60acae11bbf8ef2b5a0efbddeb87"},"record":{"path":"audits/practical-llm-in-rust/chapters/03-scalable-bpe-tokenizer/20261009T105211Z-02/english/review-seals/technical-pedagogical/record.json","sha256":"14ebad8ebe01f9527a894f1850eb6a0bb572919c5f1a29011a3c8a67e634ad88"},"role":"technical-pedagogical","routing":{"path":"audits/practical-llm-in-rust/chapters/03-scalable-bpe-tokenizer/20261009T105211Z-02/english/review-routing/review-routing.json","sha256":"b309f83a9fc8a9708ca9a885b5cc7fe297ded0a2c932ba039573d23600202b0a"},"schema":{"path":".agents/skills/author-llm-course-english/references/review-record.schema.json","sha256":"b925cf70d225af0e992c47c0000149c6d430424aee5878ff42f388948f8e7177"},"schemaVersion":1,"scopeId":"practical.ch03.en","subjectId":"practical.ch03.en.20261009.02.technical-pedagogical.01a12190","upstreamReceipt":null}
