{"binding":{"path":"audits/2026-09-18-autograd-context/english-r3/bundle/bindings.json","sha256":"fa18678d484bc5cfa9e6022052cd91bd7da963fea1bc4b5f8384d846177c6ff9"},"bundle":{"path":"audits/2026-09-18-autograd-context/english-r3/adjudication-bundle/technical-pedagogical/adjudication-bundle.json","sha256":"71844acd0bf7eda0b29771fa0697ef61c549b1568bbeb8706a60984707fb66df"},"candidateId":"autograd-context-ch33-ch37.en.r12-r6.20260918.r3","context":{"path":"audits/2026-09-18-autograd-context/english-r3/adjudication-routing/contexts/technical-pedagogical.json","sha256":"44e0f42e4ab411cee88d893304e7969269203f342e1ccd8875ec555a8686ad82"},"inventory":{"path":"audits/2026-09-18-autograd-context/english-r3/bundle/inventory.json","sha256":"7a1829bbfe94eda3a844674204b1410a17d771dfd28d74bc069865500bc5b060"},"kind":"adjudication","model":"gpt-5.6-sol","prompt":{"path":"audits/2026-09-18-autograd-context/english-r3/adjudication-routing/prompts/technical-pedagogical.json","sha256":"328ba25abc094aebe0573e4f40c2440643f48d7c68fd51f7ff6c2370569b8017"},"rawResponse":{"path":"audits/2026-09-18-autograd-context/english-r3/adjudication-raw/technical-pedagogical.json","sha256":"1e6554f5d65fae407074b308947faad9d082e4e8c0518e44b939828089c8bb1b"},"reasoning":"ultra","receiptSchema":{"path":".agents/skills/author-llm-course-english/references/evidence-receipt.schema.json","sha256":"fd3a1d8ce1230959551456015b642044fd2d60acae11bbf8ef2b5a0efbddeb87"},"record":{"path":"audits/2026-09-18-autograd-context/english-r3/adjudication-seals/technical-pedagogical/record.json","sha256":"1e6554f5d65fae407074b308947faad9d082e4e8c0518e44b939828089c8bb1b"},"role":"technical-pedagogical","routing":{"path":"audits/2026-09-18-autograd-context/english-r3/adjudication-routing/adjudication-routing.json","sha256":"ecf0940c628504b81368f8b630c8c3a904da8618fdc15e7a3d520eefb55962f0"},"schema":{"path":".agents/skills/author-llm-course-english/references/adjudication-record.schema.json","sha256":"6463982e2e84c5cea564699242abc5e681d13364e3b7457961d62f9b3c26ca69"},"schemaVersion":1,"scopeId":"autograd-context-ch33-ch37.en.20260918.r3","subjectId":"autograd-context-ch33-ch37.en.r12-r6.20260918.r3.technical-pedagogical-adjudication","upstreamReceipt":{"path":"audits/2026-09-18-autograd-context/english-r3/review-seals/technical-pedagogical/receipt.json","sha256":"84c5d7799147abb1e88924402b4a731459c8edea314b8fd716fb4336622c3a39"}}
