{"binding":{"path":"audits/2026-09-18-autograd-context/english/bundle/bindings.json","sha256":"cdcda61aaf3f3f2156ac80f3a89bafb2eaa87fcfdc6fe07518276668ce197c52"},"bundle":{"path":"audits/2026-09-18-autograd-context/english/bundle/isolated-surface/review-bundle.json","sha256":"446cda295aa178b3ddd3b2455cde7a387b319efdc4854a7b9e9614d40fe35d0b"},"candidateId":"autograd-context-ch33-ch37.en.r12-r6.20260918","context":{"path":"audits/2026-09-18-autograd-context/english/review-routing/contexts/isolated-surface.json","sha256":"a5267cf2dea79ac181bbd59528b627c4eff030d114a562a9e87666c22c98bd9f"},"inventory":{"path":"audits/2026-09-18-autograd-context/english/bundle/inventory.json","sha256":"17207c86c461d0e5ce1f63411623ed4fe0379c57515fbce831879af7172a1182"},"kind":"review","model":"gpt-5.6-sol","prompt":{"path":"audits/2026-09-18-autograd-context/english/review-routing/prompts/isolated-surface.json","sha256":"3446b07cf8acdfa4c1b7fee323637d57cfd561d9f70cc4081b1e16b96bf531ba"},"rawResponse":{"path":"audits/2026-09-18-autograd-context/english/raw/isolated-surface.json","sha256":"7a5defb82d97f75ff18c5ca945012e2ad4db531c66b532c6bf1adbd06f31ceac"},"reasoning":"ultra","receiptSchema":{"path":".agents/skills/author-llm-course-english/references/evidence-receipt.schema.json","sha256":"fd3a1d8ce1230959551456015b642044fd2d60acae11bbf8ef2b5a0efbddeb87"},"record":{"path":"audits/2026-09-18-autograd-context/english/review-seals/isolated-surface/record.json","sha256":"7a5defb82d97f75ff18c5ca945012e2ad4db531c66b532c6bf1adbd06f31ceac"},"role":"isolated-surface","routing":{"path":"audits/2026-09-18-autograd-context/english/review-routing/review-routing.json","sha256":"41ff8b932882c91e4545011757eeb849ae3f0e691a778062d58d759960e351f2"},"schema":{"path":".agents/skills/author-llm-course-english/references/review-record.schema.json","sha256":"b925cf70d225af0e992c47c0000149c6d430424aee5878ff42f388948f8e7177"},"schemaVersion":1,"scopeId":"autograd-context-ch33-ch37.en.20260918","subjectId":"autograd-context-ch33-ch37.en.r12-r6.20260918.isolated-surface.review","upstreamReceipt":null}
